{"$schema":"https://json-schema.org/draft/2020-12/schema","title":"Building Graph 2.1","type":"object","required":["schemaVersion","id","name","rooms","relationships"],"properties":{"schemaVersion":{"const":"2.1"},"id":{"type":"string"},"name":{"type":"string","minLength":1},"rooms":{"type":"array","items":{"$ref":"#/$defs/room"}},"relationships":{"type":"array","items":{"$ref":"#/$defs/link"}}},"$defs":{"room":{"type":"object","required":["id","name","type","sizeCategory","connectors"],"properties":{"id":{"type":"string"},"name":{"type":"string"},"type":{"enum":["living-room","dining-room","kitchen","bedroom","bathroom","office","hall","laundry","garage","other"]},"sizeCategory":{"enum":["small","medium","large"]},"connectors":{"type":"array","items":{"$ref":"#/$defs/connector"}}}},"connector":{"type":"object","required":["id","roomId","side","type","position"],"properties":{"id":{"type":"string"},"roomId":{"type":"string"},"side":{"enum":["top","right","bottom","left"]},"type":{"enum":["door","open-passage","window","wall-link"]},"position":{"type":"number","minimum":0,"maximum":1}}},"link":{"type":"object","required":["id","connectorA","connectorB","importance"],"properties":{"id":{"type":"string"},"connectorA":{"type":"string"},"connectorB":{"type":"string"},"importance":{"enum":["required","preferred"]}}}}}
