{"schemaVersion":"2.1","id":"reference-home","name":"Reference Home","rooms":[{"id":"living","name":"Living Room","type":"living-room","sizeCategory":"large","connectors":[{"id":"living-right-passage","roomId":"living","side":"right","type":"open-passage","position":0.5},{"id":"living-bottom-door","roomId":"living","side":"bottom","type":"door","position":0.65}]},{"id":"dining","name":"Dining Room","type":"dining-room","sizeCategory":"medium","connectors":[{"id":"dining-left-passage","roomId":"dining","side":"left","type":"open-passage","position":0.5},{"id":"dining-bottom-door","roomId":"dining","side":"bottom","type":"door","position":0.5}]},{"id":"kitchen","name":"Kitchen","type":"kitchen","sizeCategory":"medium","connectors":[{"id":"kitchen-top-door","roomId":"kitchen","side":"top","type":"door","position":0.5}]},{"id":"outside","name":"Outside","type":"other","sizeCategory":"small","connectors":[{"id":"outside-top-door","roomId":"outside","side":"top","type":"door","position":0.5}]}],"relationships":[{"id":"living-dining","connectorA":"living-right-passage","connectorB":"dining-left-passage","importance":"required"},{"id":"dining-kitchen","connectorA":"dining-bottom-door","connectorB":"kitchen-top-door","importance":"required"},{"id":"living-outside","connectorA":"living-bottom-door","connectorB":"outside-top-door","importance":"required"}]}
